{
  "$schema": "https://json-schema.org/draft/2020-12/schema",
  "$id": "final-review.schema.json",
  "type": "object",
  "additionalProperties": false,
  "required": ["version", "decision", "findings", "suggestions", "omittedSuggestions", "failures", "coverageGaps"],
  "properties": {
    "version": { "type": "string", "const": "v2" },
    "decision": { "type": "string", "enum": ["approve", "request_changes", "infrastructure_failure"] },
    "findings": {
      "type": "array",
      "maxItems": 128,
      "items": {
        "type": "object",
        "additionalProperties": false,
        "required": ["taxonomy", "path", "line", "title", "evidence", "rootCause", "level", "fingerprint"],
        "properties": {
          "taxonomy": { "type": "string", "pattern": "^[a-z][a-z0-9-]{0,63}$" },
          "path": { "type": "string", "minLength": 1, "maxLength": 500, "pattern": "^(?!/)(?!.*(?:^|/)\\.\\.(?:/|$))[^\\u0000]{1,500}$" },
          "line": { "type": "integer", "minimum": 1 },
          "title": { "type": "string", "minLength": 1, "maxLength": 180 },
          "evidence": { "type": "string", "minLength": 1, "maxLength": 6000 },
          "rootCause": { "type": "string", "minLength": 1, "maxLength": 2000 },
          "level": { "type": "string", "enum": ["blocker", "major", "minor"] },
          "fingerprint": { "type": "string", "pattern": "^[a-f0-9]{64}$" }
        }
      }
    },
    "suggestions": {
      "type": "array",
      "maxItems": 16,
      "items": {
        "type": "object",
        "additionalProperties": false,
        "required": ["taxonomy", "path", "line", "title", "evidence", "rootCause", "level", "fingerprint"],
        "properties": {
          "taxonomy": { "type": "string", "pattern": "^[a-z][a-z0-9-]{0,63}$" },
          "path": { "type": "string", "minLength": 1, "maxLength": 500, "pattern": "^(?!/)(?!.*(?:^|/)\\.\\.(?:/|$))[^\\u0000]{1,500}$" },
          "line": { "type": "integer", "minimum": 1 },
          "title": { "type": "string", "minLength": 1, "maxLength": 180 },
          "evidence": { "type": "string", "minLength": 1, "maxLength": 6000 },
          "rootCause": { "type": "string", "minLength": 1, "maxLength": 2000 },
          "level": { "type": "string", "const": "suggestion" },
          "fingerprint": { "type": "string", "pattern": "^[a-f0-9]{64}$" }
        }
      }
    },
    "omittedSuggestions": { "type": "integer", "minimum": 0 },
    "failures": {
      "type": "array",
      "maxItems": 512,
      "items": {
        "type": "object",
        "additionalProperties": false,
        "required": ["stage", "status", "error"],
        "properties": {
          "stage": { "type": "string", "minLength": 1, "maxLength": 300 },
          "status": { "type": "string", "enum": ["infra_error", "schema_error"] },
          "error": { "type": "string", "minLength": 1, "maxLength": 4000 },
          "diagnostic": { "type": "string", "minLength": 1, "maxLength": 4000 },
          "apiErrorStatus": { "type": "integer", "minimum": 100, "maximum": 599 },
          "apiErrorMessage": { "type": "string", "minLength": 1, "maxLength": 240 },
          "terminalReason": { "type": "string", "pattern": "^[a-z][a-z0-9_]{0,63}$" },
          "model": { "type": "string", "pattern": "^[A-Za-z0-9][A-Za-z0-9._:-]{0,63}$" },
          "attempts": { "type": "integer", "minimum": 0 },
          "retryable": { "type": "boolean" },
          "apiErrorStatuses": { "type": "array", "maxItems": 16, "items": { "type": "integer", "minimum": 100, "maximum": 599 } },
          "models": { "type": "array", "maxItems": 8, "items": { "type": "string", "pattern": "^[A-Za-z0-9][A-Za-z0-9._:-]{0,63}$" } }
        }
      }
    },
    "coverageGaps": {
      "type": "array",
      "maxItems": 128,
      "items": {
        "type": "object",
        "additionalProperties": false,
        "required": ["stage", "batch", "paths", "error"],
        "properties": {
          "stage": { "type": "string", "minLength": 1, "maxLength": 300 },
          "batch": { "type": "integer", "minimum": 0 },
          "paths": {
            "type": "array",
            "maxItems": 32,
            "items": { "type": "string", "minLength": 1, "maxLength": 500, "pattern": "^(?!/)(?!.*(?:^|/)\\.\\.(?:/|$))[^\\u0000]{1,500}$" }
          },
          "error": { "type": "string", "minLength": 1, "maxLength": 1000 },
          "diagnostic": { "type": "string", "minLength": 1, "maxLength": 1000 },
          "apiErrorStatus": { "type": "integer", "minimum": 100, "maximum": 599 },
          "apiErrorMessage": { "type": "string", "minLength": 1, "maxLength": 240 },
          "terminalReason": { "type": "string", "pattern": "^[a-z][a-z0-9_]{0,63}$" },
          "model": { "type": "string", "pattern": "^[A-Za-z0-9][A-Za-z0-9._:-]{0,63}$" },
          "attempts": { "type": "integer", "minimum": 0 },
          "retryable": { "type": "boolean" }
        }
      }
    }
  },
  "allOf": [
    {
      "if": {
        "properties": { "decision": { "const": "infrastructure_failure" } },
        "required": ["decision"]
      },
      "then": {
        "properties": {
          "findings": { "maxItems": 0 },
          "suggestions": { "maxItems": 0 },
          "omittedSuggestions": { "const": 0 },
          "failures": { "minItems": 1 },
          "coverageGaps": { "maxItems": 0 }
        }
      },
      "else": {
        "properties": {
          "failures": { "maxItems": 0 }
        }
      }
    },
    {
      "if": {
        "properties": { "decision": { "const": "approve" } },
        "required": ["decision"]
      },
      "then": {
        "properties": {
          "findings": {
            "items": {
              "properties": {
                "level": { "const": "minor" }
              }
            }
          }
        }
      },
      "else": {
        "if": {
          "properties": { "decision": { "const": "request_changes" } },
          "required": ["decision"]
        },
        "then": {
          "properties": {
            "findings": { "minItems": 1 }
          }
        }
      }
    }
  ]
}
