{
  "version": "v2",
  "decision": "infrastructure_failure",
  "findings": [],
  "suggestions": [],
  "omittedSuggestions": 0,
  "failures": [
    {
      "stage": "summary:stale-session-token-scenario",
      "status": "infra_error",
      "error": "after 3 attempts: claude exited 1",
      "diagnostic": "{\"events\":[{\"type\":\"system\",\"subtype\":\"init\",\"model\":\"cc-review-lite\",\"apiKeySource\":\"ANTHROPIC_API_KEY\",\"claudeCodeVersion\":\"2.1.220\"},{\"type\":\"result\",\"subtype\":\"success\",\"isError\":true,\"apiErrorStatus\":400,\"terminalReason\":\"api_error\"}],\"stderr\":\"\"}"
    }
  ],
  "coverageGaps": []
}
